{
  "schema": "toolpack.phantom.dev/v1",
  "identity": {
    "id": "offline-password-audit",
    "name": "Offline Password Audit",
    "summary": "Hash identification and offline cracking against user-provided hash material only. Local hash files and wordlists are inputs, not remote scope targets.",
    "category": "passwords",
    "version": "1.0.0",
    "channel": "builtin",
    "publisher": {
      "id": "phantom-builtin",
      "name": "PHANTOM Built-ins"
    },
    "license": "Apache-2.0"
  },
  "compatibility": {
    "phantom_min": "1.0.0",
    "platforms": ["linux", "docker"],
    "container_profiles": ["base", "passwords"]
  },
  "trust": {
    "digest": "sha256:0000000000000000000000000000000000000000000000000000000000000005",
    "signed_by": "phantom-builtin",
    "provenance": {
      "source": "builtin",
      "build_ref": "server/toolpacks/toolpack-registry.js"
    }
  },
  "risk": {
    "action_classes": ["offline-password-audit", "read/local"],
    "default_allowed": ["offline-password-audit", "read/local"],
    "default_deny": ["online-bruteforce", "credential-stuffing", "spraying", "destructive"],
    "scope_required": true,
    "target_required": false,
    "credential_rules": {
      "passive_only": false,
      "offline_only": true,
      "allow_credential_use": true,
      "allow_online_login": false
    },
    "network_egress": {
      "allowed": false
    }
  },
  "install": {
    "recipes": [
      { "kind": "apt", "packages": ["john", "wordlists", "hashcat", "seclists"], "platforms": ["linux"] },
      { "kind": "pipx", "packages": ["hashid", "name-that-hash"] }
    ],
    "privilege": { "requires_root": false }
  },
  "tools": [
    { "name": "hashid", "command": "hashid", "risk_class": "read/local", "scope_required": false, "level": "basic", "parser": "hash_types", "install_hint": "pipx install hashid" },
    { "name": "name-that-hash", "command": "nth", "risk_class": "read/local", "scope_required": false, "level": "basic", "parser": "hash_types", "install_hint": "pipx install name-that-hash" },
    { "name": "john", "command": "john", "risk_class": "offline-password-audit", "scope_required": true, "level": "basic", "parser": "cracked_summary", "install_hint": "sudo apt install john wordlists" },
    { "name": "hashcat", "command": "hashcat", "risk_class": "offline-password-audit", "scope_required": true, "level": "kali", "parser": "cracked_summary", "install_hint": "sudo apt install hashcat seclists" }
  ],
  "prompt": {
    "playbook": "Offline Password Audit: identify hash types and assess password strength only against provided local hash material. Wordlists such as rockyou.txt, SecLists, or operator-generated candidates are local inputs and should not be treated as remote scope targets. Start at Basic unless the operator selects/requests Kali-level depth. Never perform online brute force, credential stuffing, password spraying, or live login attempts under this toolpack."
  },
  "outputs": {
    "parsers": [
      { "id": "hash_types", "kind": "json" },
      { "id": "cracked_summary", "kind": "text", "description": "Summary of cracked-vs-uncracked hashes; never echoes plaintext passwords." }
    ]
  },
  "templates": {
    "campaigns": [
      { "id": "offline-password-audit-basic", "title": "Basic offline audit", "description": "Hash identification + small wordlist." },
      { "id": "offline-password-audit-kali", "title": "Kali-level offline audit", "description": "John + Hashcat with standard local wordlists." }
    ]
  },
  "docs": {
    "readme": "Offline-only hash audit against operator-supplied material."
  },
  "review": {
    "status": "approved",
    "reviewed_by": "phantom-builtin",
    "flags": {
      "exploit": false,
      "destructive": false,
      "credentialed": true,
      "network_egress": false,
      "requires_secrets": true
    }
  },
  "lifecycle": {
    "status": "active"
  }
}
