{
  "schema": "toolpack.phantom.dev/v1",
  "identity": {
    "id": "credentialed-service-audit",
    "name": "Credentialed Service Audit",
    "summary": "Authorized online authentication testing for explicitly scoped services, separate from offline hash cracking.",
    "category": "passwords",
    "version": "1.0.0",
    "channel": "builtin",
    "publisher": {
      "id": "phantom-builtin",
      "name": "PHANTOM Built-ins"
    },
    "license": "Apache-2.0"
  },
  "compatibility": {
    "phantom_min": "1.0.0",
    "platforms": ["linux", "docker"],
    "container_profiles": ["base", "passwords"]
  },
  "trust": {
    "digest": "sha256:0000000000000000000000000000000000000000000000000000000000000006",
    "signed_by": "phantom-builtin",
    "provenance": {
      "source": "builtin",
      "build_ref": "server/toolpacks/toolpack-registry.js"
    }
  },
  "risk": {
    "action_classes": ["online-bruteforce", "credentialed"],
    "default_allowed": [],
    "default_ask": ["online-bruteforce", "credentialed"],
    "default_deny": ["credential-stuffing", "spraying", "destructive"],
    "scope_required": true,
    "target_required": true,
    "credential_rules": {
      "passive_only": false,
      "offline_only": false,
      "allow_credential_use": true,
      "allow_online_login": true
    },
    "network_egress": {
      "allowed": true,
      "destinations": ["scope-targets"]
    },
    "rate_caps": {
      "requests_per_second": 1,
      "concurrent": 1,
      "max_runtime_seconds": 900
    }
  },
  "install": {
    "recipes": [
      { "kind": "apt", "packages": ["smbclient", "hydra", "medusa", "ncrack"], "platforms": ["linux"] }
    ],
    "privilege": { "requires_root": false }
  },
  "tools": [
    { "name": "smbclient", "command": "smbclient", "risk_class": "online-bruteforce", "scope_required": true, "level": "basic", "parser": "auth_attempt_summary", "install_hint": "sudo apt install smbclient" },
    { "name": "hydra", "command": "hydra", "risk_class": "online-bruteforce", "scope_required": true, "gated": true, "level": "kali", "parser": "hydra_summary", "install_hint": "sudo apt install hydra" },
    { "name": "medusa", "command": "medusa", "risk_class": "online-bruteforce", "scope_required": true, "gated": true, "level": "kali", "parser": "auth_attempt_summary", "install_hint": "sudo apt install medusa" },
    { "name": "ncrack", "command": "ncrack", "risk_class": "online-bruteforce", "scope_required": true, "gated": true, "level": "kali", "parser": "auth_attempt_summary", "install_hint": "sudo apt install ncrack" }
  ],
  "prompt": {
    "playbook": "Credentialed Service Audit: only run online authentication tests against explicitly scoped services with authorization, low rates, and clear stop conditions. Basic level uses tiny supplied candidate lists. Kali level may use Hydra/Medusa/Ncrack and larger local wordlists only when scope allows online-bruteforce for the target. Do not spray unrelated users, reuse leaked credentials, or test out-of-scope services."
  },
  "outputs": {
    "parsers": [
      { "id": "auth_attempt_summary", "kind": "json" },
      { "id": "hydra_summary", "kind": "text" }
    ]
  },
  "templates": {
    "campaigns": [
      { "id": "credentialed-service-audit-basic", "title": "Basic online auth probe" },
      { "id": "credentialed-service-audit-kali", "title": "Kali-level online auth probe" }
    ]
  },
  "docs": {
    "readme": "Online auth testing — scope, target, and rate caps required."
  },
  "review": {
    "status": "approved",
    "reviewed_by": "phantom-builtin",
    "flags": {
      "exploit": false,
      "destructive": false,
      "credentialed": true,
      "network_egress": true,
      "requires_secrets": true
    }
  },
  "lifecycle": {
    "status": "active"
  }
}
